{
  "schema_version": "1.0.0",
  "kind": "match_result",
  "engine_version": "pilot-1.0.0",
  "policy_registry_version": "pilot-1.0.0",
  "taxonomy_version": "1.0.0",
  "request_id": "request-001",
  "input_fingerprint": "41b74b6901b538318ec844a9a6ff57ae3147fa6bef4031625db088d3e1dc0403",
  "policy": {
    "schema_version": "1.0.0",
    "kind": "matching_policy",
    "policy_id": "golden-policy",
    "policy_registry_version": "pilot-1.0.0",
    "catalog_record_ids": [
      "record-main",
      "record-secondary"
    ],
    "catalog_priority": [
      "record-main",
      "record-secondary"
    ],
    "brands": {
      "include": [],
      "exclude": [
        "brand.blocked"
      ],
      "preferred": [],
      "unknown": "allow"
    },
    "max_match_level": "alternative",
    "catalog_needs_review": "exclude"
  },
  "catalog_refs": [
    {
      "catalog_record_id": "record-main",
      "catalog_id": "synthetic-valves",
      "source_sha256": "0000000000000000000000000000000000000000000000000000000000000000"
    }
  ],
  "lines": [
    {
      "line_id": "request-valve.ball",
      "resolution": "excluded_by_policy",
      "candidates": [],
      "excluded_candidates": [
        {
          "offer_ref": {
            "catalog_record_id": "record-main",
            "catalog_id": "synthetic-valves",
            "source_sha256": "0000000000000000000000000000000000000000000000000000000000000000",
            "source_item_id": "synthetic-valve.ball-1"
          },
          "match_level": "exact",
          "availability": "eligible",
          "checks": [
            {
              "scope": "class",
              "target": {
                "class_id": "valve.ball"
              },
              "outcome": "pass",
              "effect": "exact",
              "code": "BRAND_EXCLUDED"
            }
          ],
          "differences": [],
          "exclusion_codes": [
            "BRAND_EXCLUDED"
          ]
        }
      ],
      "rejection_summary": []
    }
  ],
  "summary": {
    "lines": 1
  }
}
