{
  "schema_version": "1.0.0",
  "kind": "match_result",
  "engine_version": "pilot-1.0.0",
  "policy_registry_version": "pilot-1.0.0",
  "taxonomy_version": "1.0.0",
  "request_id": "request-001",
  "input_fingerprint": "eb141e2cd2fed1996be6afccbceda9f4cf684a58c67b6ec72bd376f63ec854a1",
  "policy": {
    "schema_version": "1.0.0",
    "kind": "matching_policy",
    "policy_id": "golden-policy",
    "policy_registry_version": "pilot-1.0.0",
    "catalog_record_ids": [
      "record-main"
    ],
    "catalog_priority": [
      "record-main"
    ],
    "brands": {
      "include": [],
      "exclude": [],
      "preferred": [],
      "unknown": "allow"
    },
    "max_match_level": "alternative",
    "catalog_needs_review": "exclude"
  },
  "catalog_refs": [
    {
      "catalog_record_id": "record-main",
      "catalog_id": "synthetic-valves",
      "source_sha256": "0000000000000000000000000000000000000000000000000000000000000000",
      "catalog_revision": 0
    }
  ],
  "lines": [
    {
      "line_id": "request-valve.ball",
      "resolution": "excluded_by_policy",
      "candidates": [],
      "excluded_candidates": [
        {
          "offer_ref": {
            "catalog_record_id": "record-main",
            "catalog_id": "synthetic-valves",
            "source_sha256": "0000000000000000000000000000000000000000000000000000000000000000",
            "source_item_id": "synthetic-valve.ball-1"
          },
          "match_level": "exact",
          "availability": "manual_only",
          "checks": [
            {
              "scope": "class",
              "target": {
                "class_id": "valve.ball"
              },
              "expected": "valve.ball",
              "actual": "valve.ball",
              "outcome": "pass",
              "effect": "exact",
              "code": "CLASS_MATCH"
            },
            {
              "scope": "attribute",
              "target": {
                "field": "body_material"
              },
              "operator": "eq",
              "expected": "aluminum",
              "actual": "aluminum",
              "outcome": "pass",
              "effect": "exact",
              "code": "ATTRIBUTE_MATCH"
            },
            {
              "scope": "policy",
              "target": {
                "annotation_status": "needs_review"
              },
              "outcome": "fail",
              "effect": "reject",
              "code": "CATALOG_ITEM_NEEDS_REVIEW"
            }
          ],
          "differences": [],
          "exclusion_codes": [
            "CATALOG_ITEM_NEEDS_REVIEW"
          ]
        }
      ],
      "rejection_summary": []
    }
  ],
  "summary": {
    "lines": 1
  }
}
