{
  "schema_version": "1.0.0",
  "kind": "match_result",
  "engine_version": "pilot-1.0.0",
  "policy_registry_version": "pilot-1.0.0",
  "taxonomy_version": "1.0.0",
  "request_id": "request-001",
  "input_fingerprint": "115066d2806a1272b8152424fbdb496596799e252e220cd8b60a01f81b7ceda2",
  "policy": {
    "schema_version": "1.0.0",
    "kind": "matching_policy",
    "policy_id": "golden-policy",
    "policy_registry_version": "pilot-1.0.0",
    "catalog_record_ids": [
      "record-main",
      "record-secondary"
    ],
    "catalog_priority": [
      "record-main",
      "record-secondary"
    ],
    "brands": {
      "include": [],
      "exclude": [],
      "preferred": [],
      "unknown": "allow"
    },
    "max_match_level": "alternative",
    "catalog_needs_review": "exclude"
  },
  "catalog_refs": [
    {
      "catalog_record_id": "record-main",
      "catalog_id": "synthetic-valves",
      "source_sha256": "0000000000000000000000000000000000000000000000000000000000000000"
    }
  ],
  "lines": [
    {
      "line_id": "request-valve.ball",
      "resolution": "single_exact",
      "candidates": [
        {
          "offer_ref": {
            "catalog_record_id": "record-main",
            "catalog_id": "synthetic-valves",
            "source_sha256": "0000000000000000000000000000000000000000000000000000000000000000",
            "source_item_id": "synthetic-valve.ball-1"
          },
          "match_level": "exact",
          "availability": "eligible",
          "checks": [
            {
              "scope": "class",
              "target": {
                "class_id": "valve.ball"
              },
              "outcome": "pass",
              "effect": "exact",
              "code": "CLASS_MATCH"
            }
          ],
          "differences": []
        }
      ],
      "excluded_candidates": [],
      "rejection_summary": []
    }
  ],
  "summary": {
    "lines": 1
  }
}
