{
  "schema_version": "1.0.0",
  "kind": "match_result",
  "engine_version": "pilot-1.0.0",
  "policy_registry_version": "pilot-1.0.0",
  "taxonomy_version": "1.0.0",
  "request_id": "request-001",
  "input_fingerprint": "2222222222222222222222222222222222222222222222222222222222222222",
  "policy": {
    "schema_version": "1.0.0",
    "kind": "matching_policy",
    "policy_id": "golden-policy",
    "policy_registry_version": "pilot-1.0.0",
    "catalog_record_ids": [
      "record-main",
      "record-secondary"
    ],
    "catalog_priority": [
      "record-main",
      "record-secondary"
    ],
    "brands": {
      "include": [],
      "exclude": [],
      "preferred": [],
      "unknown": "allow"
    },
    "max_match_level": "alternative",
    "catalog_needs_review": "exclude"
  },
  "catalog_refs": [
    {
      "catalog_record_id": "record-main",
      "catalog_id": "synthetic-valves",
      "source_sha256": "0000000000000000000000000000000000000000000000000000000000000000"
    }
  ],
  "lines": [
    {
      "line_id": "request-valve.ball",
      "resolution": "equivalent_only",
      "candidates": [
        {
          "offer_ref": {
            "catalog_record_id": "record-main",
            "catalog_id": "synthetic-valves",
            "source_sha256": "0000000000000000000000000000000000000000000000000000000000000000",
            "source_item_id": "synthetic-valve.ball-1"
          },
          "match_level": "equivalent",
          "availability": "eligible",
          "checks": [
            {
              "scope": "class",
              "target": {
                "class_id": "valve.ball"
              },
              "outcome": "pass",
              "effect": "equivalent",
              "code": "ATTRIBUTE_DIFFERENCE"
            }
          ],
          "differences": [
            {
              "scope": "attribute",
              "target": {
                "field": "pilot_rule"
              },
              "outcome": "difference",
              "effect": "equivalent",
              "code": "EQUIVALENT_RULE_APPLIED"
            }
          ]
        }
      ],
      "excluded_candidates": [],
      "rejection_summary": []
    }
  ],
  "summary": {
    "lines": 1
  }
}