{
  "schema_version": "1.0.0",
  "kind": "match_result",
  "engine_version": "pilot-1.0.0",
  "policy_registry_version": "pilot-1.0.0",
  "taxonomy_version": "1.0.0",
  "request_id": "request-001",
  "input_fingerprint": "60371de81315e5900875a9cfa9d98f522f6d0115806ad4fb068c2a891453aa5d",
  "policy": {
    "schema_version": "1.0.0",
    "kind": "matching_policy",
    "policy_id": "golden-policy",
    "policy_registry_version": "pilot-1.0.0",
    "catalog_record_ids": [
      "record-main"
    ],
    "catalog_priority": [
      "record-main"
    ],
    "brands": {
      "include": [],
      "exclude": [],
      "preferred": [],
      "unknown": "allow"
    },
    "max_match_level": "alternative",
    "catalog_needs_review": "exclude"
  },
  "catalog_refs": [
    {
      "catalog_record_id": "record-main",
      "catalog_id": "synthetic-valves",
      "source_sha256": "0000000000000000000000000000000000000000000000000000000000000000",
      "catalog_revision": 0
    }
  ],
  "lines": [
    {
      "line_id": "request-valve.ball",
      "resolution": "request_review_required",
      "candidates": [],
      "excluded_candidates": [],
      "rejection_summary": [
        {
          "code": "REQUEST_REVIEW_REQUIRED",
          "count": 1
        }
      ]
    }
  ],
  "summary": {
    "lines": 1
  }
}
